domain,theme,value1,value2,brief introduction,scene,role1,D1,role2,D2,relation,conflict_level,id
教育/培训/学校/校园,学生心理咨询服务,慈善,成就,在学生心理咨询服务这个场景中，咨询师可能面临帮助学生（慈善）与追求自身专业成就（成就）的冲突,学生心理咨询中心面临一项决策，一个来自于贫困家庭的优秀学生因为家庭困难导致心理问题，需要定期进行咨询。然而这项服务需要一定的费用，该学生并无能力支付，而此时心理咨询中心的经费也紧张。决策的目的在于是否免费为这名学生提供心理咨询服务，决策带来的分歧在于如何平衡经费和学生的需求。,心理咨询师玛丽。玛丽作为一个经验丰富的咨询师，她切身知道心理健康对学生的重要性，并且她对帮助别人有着强烈的使命感,决定尽可能挤出时间，无偿为这名学生提供心理咨询服务。,心理咨询中心的经理约瑟夫。作为一名管理者，约瑟夫一直以提升咨询中心的服务水平和影响力为己任。他希望通过优质的服务吸引更多的学生，从而获取更多的资金支持，进一步提升中心的服务能力,认为虽然帮助这名学生是重要的，但如果只靠资金不足的中心来支持，可能会影响到其他付费的学生。因此，建议寻求校方的资助，或者呼吁社会人士捐款来解决这个问题，以此提升中心的影响力。,上下级,3,72
教育/培训/学校/校园,学生心理咨询服务,安全,刺激,在心理咨询中，安全感是非常重要的，但是学生可能想要从咨询师那里得到一些刺激性的建议去面对生活中的挑战，这可能会和咨询师提供一个安全、稳定的环境之间产生冲突,在某大学内，近期出现了一些学生的心理问题。为此，学校决定提供学生心理咨询服务，希望帮助这些学生解决心理问题。然而，在具体的决策过程中，有人主张应该提供一个安全稳定的环境，让学生感到安心并鼓励他们分享自己的困扰。另一些人则认为应该提供一些新奇刺激的心理咨询方法，以吸引更多学生主动参与。,玛丽，是一位经验丰富的心理咨询师，擅长运用理论和心理治疗技巧来处理学生的心理问题。她相信在一个稳定安全的环境中，学生更易于打开心扉，分享他们的困扰,提议预先为咨询室布置一个舒适的环境，使用温和的语言和方式与学生交谈，适时给予学生肯定和鼓励，以增强学生的安全感和满意度。,詹姆斯，是一位年轻有活力的心理咨询师，主张尝试新的咨询方法，他认为一些新奇刺激的方法能够吸引学生的注意力，并激发他们对心理咨询的兴趣,建议使用一些创新的心理咨询方法，例如通过角色扮演、小组咨询等方式让学生在参与中解决心理问题。,他们是共同工作的心理咨询师，各自拥有不同的咨询理念和方法。,3,73
教育/培训/学校/校园,学生心理咨询服务,遵从,慈善,学生可能面临着遵从父母或社会期待（如学业成绩，就业选择等）与追求个人快乐和满足（比如追求自己喜欢的艺术或者娱乐活动）的冲突，咨询师需要帮助他们在这两者之间找到平衡,一所著名大学决定启动一项心理咨询服务，该服务主要是为了帮助学生处理学业、就业、人际关系等各种心理压力。但是，这一决定引起了一些内部分歧，一些教师认为学生更应该专注于学业与未来的职业选择，而另一些教师则主张应该让学生有更多时间去享受生活，追求他们的兴趣和爱好。,李教授，李教授是一位严谨的学者，他认为学生应该把大部分的时间和精力投入到学业上，他认为这是学生的首要任务,认为心理咨询服务应该着重于帮助学生处理学业压力，建议提供一些学习方法和技巧的指导。,张教授，张教授是一位开放思想的教师，他认为学生应该有更多的时间去追求自己的兴趣和爱好，以此来丰富自己的人生体验和提升自己的综合素质,认为心理咨询服务应该着重于帮助学生处理生活压力，建议提供一些生活指导和心理调适的建议。,他们是同一所大学的教师，共同关心学生的成长与发展。,3,74
教育/培训/学校/校园,学生住宿安排,安全,自我导向,在安排学生住宿的场景中，可能出现的冲突包括校方为了学生的安全，可能会设置较为严格的住宿规定，例如：晚归时间限制，或者不允许在宿舍内烹饪等,大学校园将重新被允许学生入住，学校行政部门在考虑如何进行住宿安排。目前面临的大问题是：晚归是否有时间限制，以及宿舍中是否应该允许烹饪。决策的背景是疫情的影响，决策的目的是在确保学生的安全和满足学生对自由选择的期望之间找到平衡，决策带来的分歧是在保证安全和提供自由选择之间的冲突。,玛丽，她是学校的宿舍管理员，负责所有学生宿舍的管理工作。她非常专业且细心，始终坚持学生的安全是第一位的,认为晚归应该有时间限制，宿舍内不允许烹饪。因为这样可以最大程度地保障学生的安全。,詹姆斯，他是学生会主席，充满活力并且具有极强的个性，他倡导学生应该有更多自我决定权,认为学生应该有更多自由，包括晚归没有时间限制和在宿舍中允许烹饪，这样可以满足他们自我探索和成长的需要。,在学生住宿安排这个问题上，玛丽和詹姆斯分别代表了学校行政部门和学生会，他们都是为了学生的福祉考虑，但在如何保护和提升学生福祉的方式上有所分歧。,3,75
教育/培训/学校/校园,学生住宿安排,权力,大同,如学校宿舍的空位有限，学校可能会将优先权给予某些特定的学生群体，例如学习成绩优秀的学生或是学校的学生领导,本年度的新生招生比例增加了，但是学生宿舍没有相应的扩建，导致宿舍空位不足。学校现在面临一个难以决策的问题，那就是应该如何分配有限的宿舍空位。校长助理，詹姆斯，提议优先给学习成绩优秀的学生和学校代表性的学生领导。而教务主任，里奥，认为应该公平、均等的分配给所有的学生，避免造成学生之间的差距。,詹姆斯，学校的校长助理，对于管理学校有着独特和成功的理念，他认为优秀的和有影响力的学生应该得到更多的待遇,决定优先分配宿舍给学习成绩优秀的学生和学生领导，这样可以激励其他学生更加努力学习和积极参与学校活动，提高自己的社会地位和影响力。,里奥，学校的教务主任，对于教育有深厚的热爱，他认为教育的本质是公平和均等，应该让每个学生都有平等的机会,认为宿舍应该公平的分配给所有的学生，这样才能体现公正，避免造成学生之间的不公平。,詹姆斯和里奥都是学校的重要管理人员，平时的工作中需要密切的配合和共同的决策，他们之间的关系十分密切。,3,76
教育/培训/学校/校园,学生住宿安排,享乐主义,遵从,一些学生可能倾向于享乐主义，他们希望住宿环境轻松愉快，希望与朋友共享空间，可能会举办一些晚上的聚会活动等,大学即将安排住宿，现在需要决定是单人寝室还是多人寝室。部分学生希望寝室空间开放，可以邀请朋友来玩，乐在其中；而另一部分学生则希望保持寝室的安静，遵从学校的纪律，专心学习。,Mike，一位乐观开朗的学生，热爱社交，非常善于交友。他的生活充满了活力，他总是喜欢与人分享他的快乐,主张设置多人寝室，认为学生之间的交流对于自身成长和社会能力的培养非常重要。此外，期待在寝室中创造出更多有趣的活动，以此为同学们带去快乐。,Lisa，一位严谨认真的学生，遵从规则，她认为学校是学习的地方，应当维持一种安静，有利于学习的环境,倾向于单人寝室，认为保持寝室的安静有利于专心学习。同时，也希望大家能遵守学校的规章制度，保持寝室环境的整洁。,朋友,1,77
教育/培训/学校/校园,学生住宿安排,刺激,传统,一些学生可能倾向于寻看新奇和刺激的生活方式，比如选择异国他乡的留学生作为舍友，期待通过他们体验不同的文化,学校决定为新学期的学生住宿安排另设一项选择：提供一个机会让学生选择是否愿意与来自不同文化背景的留学生共同生活。决策的目的是为了丰富学生的生活体验，增强学生之间的理解和交流，但是这个决策引发了学生之间的不同观点和分歧。,Tom，是一个富有冒险精神的学生，热衷于尝试新事物，对于不同的文化有着极高的好奇心,选择和一位来自日本的留学生结伴同住，认为这是一个能够深入了解不同文化，得到刺激和挑战的好机会。,Mike，是一个比较保守的学生，重视自己的习惯和纪律，更愿意维持现状，尊重自己的本土文化,选择和来自自己国家的室友同住，觉得这样更能保持自己的生活习惯，不需要为了适应他人而改变自己的规律和习惯。,同学,1,78
教育/培训/学校/校园,学术不端行为处理,成就,慈善,在'学术不端行为处理'的情况中，有可能出现一些学生为了个人的学业成就，比如获得高分或者优秀的学术成果，可能会作弊或剽窃他人的成果，这与公正的价值观产生冲突，因为公正主张公平公正的处事，尊重他人的努力和成果,一所著名的大学最近发现，学生提交的学术论文中有很大一部分存在剽窃他人成果的情况。这些学生大都是为了获得更高的分数和社会声望，他们忽视了学术的原则和公正性。大学管理部门决定对这种行为进行处理，但是具体的处罚方式引发了不小的争议。,杰克，杰克是大学管理部门的一名成员，他一直在努力为自己的职业生涯打下坚实的基础，以取得更高的成就。他相信只有严厉的惩罚才能遏制这种行为的发生,提议对于存在学术不端行为的学生，学校应该严厉处罚，直至开除学籍，以此作为警示，避免类似的情况再次发生。,艾米，艾米是大学的一名教授，她对待学生充满了理解和同情，她认为每个人都应该有改正错误的机会，而不是被直接开除,提出应该给予学生们改正错误的机会，而不是直接开除他们。提议设置一次警告，让他们意识到自己的过错，同时学校应该对他们进行更多关于学术道德的教育。,同事,3,79
教育/培训/学校/校园,学术不端行为处理,权力,慈善,在处理学术不端行为的过程中，校方或者教师可能掌握着决定性的权力，可能会出现滥用权力的情况，这就与慈善的价值观形成冲突，因为慈善主张维护和提高那些自己熟识的人们的福利,在大学教育领域，一起涉及学术不端的事件引起了广泛关注。学生A被发现在大型课程中抄袭了他人的研究成果提交作业。该事件已经被告知了学校的学术不端行为处理委员会，现在他们需要做出一个决策：是严肃处理，将学生A开除，以此彰显学术规范的重要性，还是给予学生A警告并给他一个改正的机会。对此，不同的观点和决策在委员会中产生了分歧。,理查德，理查德是学术不端行为处理委员会的主席，一直以来，他都对追求学术诚信抱有强烈的信念，他认为对那些破坏了这种规则的人应该给予严厉的惩罚。在学校中，他有着决定性的权力,决定处以最严厉的惩罚，即开除学生A，以此来维护自己的权力和学术的公平性。,萨拉，萨拉是学术不端行为处理委员会的一名成员，她是一名教育心理学教师，她总是期待能够为学生创造一个充满关爱和理解的环境。在萨拉看来，学生A可能是因为压力或者对规则的不了解而犯了错误,反对严厉惩罚学生A，认为应该给学生A一次改正错误的机会，让他学习到这次的教训，而不是直接剥夺他的学习机会。,同事,3,80
教育/培训/学校/校园,学术不端行为处理,遵从,自我导向,在学术环境中，学生可能会面临遵从学术规则与追求自我导向的冲突,高校一年级的期末考试周正进行，一件忽然爆发的学术不端行为引起了学校领导的重视。某学生被指控在化学期末考试中作弊，这个学生坚称自己并没有作弊，而其他的一些同学也为他作证。学校决定将这个问题交给化学系的系主任和教务处长来处理。这个决策的目标是要确定是否对被指控的学生进行处罚。然而，对这个问题的看法在化学系的系主任和教务处长之间产生了分歧。,Richard，他是该校的化学系主任，一位严谨、认真，并相信规则和纪律的人。他对于学术诚信持有极端重要的看法，并且在任何情况下都坚决反对学术不端行为,认为应该对涉嫌作弊的学生进行严肃的处理，哪怕有学生为他作证，也不能轻易相信他的解释。认为尽管这样可能会伤害到这个学生，但是对于规则的遵守却至关重要。,Susan，她是该校的教务处长，一位鼓励学生独立思考，倡导探索精神，并敢于对错误承担责任的人。她认为学术不端行为并非都是那样的黑白分明，需要更多的理解和指导而不是简单的惩罚,建议进行深度调查，而不是仅凭一项指控就断定学生的行为。在调查中，如果发现学生确实存在问题，建议对该生进行适当的指导和帮助，而不是直接惩罚，以鼓励学生独立思考，尊重学术，从错误中学习和成长。,同事,3,81
教育/培训/学校/校园,学术不端行为处理,享乐主义,安全,在学术环境中，一些学生可能会为了个人的快乐或感官上的满足，比如为了避免学习压力、享受轻松，而选择抄袭、剽窃等不正当手段，这就与追求安全稳定的学术环境的价值观发生冲突,在某个学术论坛上，一篇被广泛关注的论文被发现有部分内容涉嫌抄袭，引发了广大学术界人士的炽热讨论。论坛的组织方现在需要做出决策，是封禁涉嫌抄袭的作者，还是给予警告后对其宽恕。决策的目的是维护学术环境的公正和纯洁，但决策带来的分歧就在于，封禁可能让创新的气氛受挫，宽恕可能让抄袭行为得以滋生。,杰克，一位骨干教师，对自己的教学事业有着深深的热爱，但同时也是一位追求享乐的独立思考者，喜欢在学术上尝试新的事物,认为在这个问题上应该给予涉嫌抄袭的作者宽恕，认为这不仅是给予其犯错改正的机会，更是在维护学术界的多样性和创新，为了避免打击学术界的创新气氛，他选择宽恕。,艾米，一位严谨的教授，对学术界的研究和教学环境有着严格的要求，始终坚持严谨求实的态度,坚决主张封禁涉嫌抄袭的作者，认为这样才能更好地保护学术环境的公正和纯洁，维护文章的安全，也是对其他作者的公平对待。,同为该学术论坛的决策委员会成员，对于学术界有着深厚的热爱，并共同面对这个问题的处理决策。,3,82
教育/培训/学校/校园,学生奖学金制度,权力,大同,在奖学金分配制度设计中，如果校园中的权力操控者以权力地位和声望为主要考量，可能会偏向于奖励那些已经表现出强烈领导力或突出贡献的学生，这种情况下可能会忽视到那些可能更需要资金支持但暂时未有显著表现的边缘或弱势群体，与人人平等，追求社会公正的大同价值观形成冲突,一所大学正在讨论其新学年度的奖学金分配制度，决策的目的是如何更合理地分配奖学金，使之既能激励优秀学生，又能帮助在学业和生活中存在困难的学生。然而在分配比例和对象的选择方面引发了不同的看法。,约瑟夫，他是大学的财务部门负责人，有一定的决策权力。约瑟夫认为奖学金应该主要分配给那些在学业和课外活动中有亮眼表现的学生，他认为这样可以提高学校的声誉和地位，吸引更多的优秀学生来此就读，并激励学生们提高自己的竞争力,提出将大部分奖学金分配给在学术、艺术、体育等方面有出色表现的学生。,艾米丽，她是大学的社会服务部门主任，对学生的生活贫困情况有深入的了解。艾米丽认为奖学金不应只注重学生的优秀表现，而应更多地考虑到经济困难的学生。她认为帮助他们可以减轻他们的生活压力，让他们有更多的精力来专注于学习，这也是大同社会应该做的事情,提出将一部分奖学金专门设立为助学金，并指定给那些经济困难但努力学习的学生。,他们都是大学的工作人员，虽然职务不同，但都对学生奖学金制度的决策有着重要的影响。,3,83
教育/培训/学校/校园,学生奖学金制度,成就,慈善,如果奖学金制度过分强调学术成绩或其他成就，可能会忽视对处于不利环境中努力上进的学生的实质性援助，与维护和提高那些自己熟识的人们的福利的慈善价值观产生冲突,在皇家大学，学生奖学金制度每年都是一个重要的议题。大学管理者们致力于提供一个公平且激励优秀学生的奖学金制度。今年，校方打算调整奖学金制度，侧重于优秀学生的奖励，旨在提高大学的学术声誉。然而，对此做法的看法却有所分歧。,William，皇家大学的财务主管，坚信高人一等的成就应该得到相应的奖励，以此鼓励所有学生更努力学习，提高学术成就,提议奖学金应该主要颁发给获得年级前10%成绩的学生，这样可以激励所有学生努力提高学术成就，从而提升整个大学的学术声誉。,Emma，皇家大学的学生事务主管，她关心所有学生，尤其是那些遭受生活压力，但仍努力学习的学生。她认为学校应该在一定程度上关注他们的福利,提出应该为那些经济困难但学习态度积极的学生预留一部分奖学金，以尽可能地减轻他们的经济压力，使他们能更集中精力在学业上。,William和Emma都是皇家大学的管理层，他们需要共同决定学生奖学金的发放问题。,2,84
教育/培训/学校/校园,学生奖学金制度,安全,自我导向,为了保障奖学金制度的公平公正，可能会制定出严格的标准和流程，而这可能抑制了学生自主选择、创新、探索的自我导向价值观,本校正在制定新的奖学金制度，决策背景主要是因为当前的奖学金制度抑制了学生的个性发展和创新能力，而新的制度希望能解决这个问题。然而在决策过程中出现了分歧，一方面，学校希望保障奖学金的公平分配，确保所有表现优秀的学生都能得到奖励，另一方面，学校也希望创新奖学金制度，把更多的机会给予有创新精神和挑战精神的学生。,黄校长，具有多年的教育经验和深厚的教育情怀，对于公平公正有着深深的执着，相信每一个学生都应该得到平等对待，价值观：安全。,支持维持现有的奖学金制度，认为这样可以确保所有表现优秀的学生都能得到奖学金，对于自己来说，最重要的是确保所有学生的权益，也让学生安心投入到学习中，不用因为奖学金的分配制度而产生困扰。,李教务主任，有着开放的思想和丰富的管理经验，经常尝试引进新的教育理念和方法，认为学校应该培养学生的创新精神和个性发展，价值观：自我导向。,提出新的奖学金制度，认为这样可以更好地激发学生的创新精神和挑战精神，让他们有更大的自我发展空间，为学校带来更多新的变化和创新。,同事,3,85
教育/培训/学校/校园,学生奖学金制度,享乐主义,遵从,有的学生可能更注重个人快乐和感官满足，过于追求享乐可能忽视了奖学金制度中对于遵守规则、自我约束的要求，与遵从价值观形成冲突,大学新一届的奖学金评选制度改革正在进行中，希望通过制度改革鼓励学生更积极地参与到学术和社会实践活动中来。决策的目的在于使奖学金更公平地分配给那些在学习和活动中表现优秀的同学。然而，关于奖学金的分配比例和评选标准的具体设定，校方的决策引发了大量争议。,杰克，非常享受大学生活，喜欢参加各种社交活动，追求个人的快乐和感官满足。他认为大学是享受生活，锻炼自我的地方，而不仅仅是学习,认为奖学金应该更注重学生在校生活的质量，例如参加社团活动、社区服务等，而不是仅仅看重学术成绩。认为这样更能满足学生的个人发展和快乐追求。,苏珊，是个典型的学霸，她非常尊重和遵守规则，认为学生的主要任务就是学习，获取优秀的学业成绩。她的价值观是遵从。,坚持认为学业成绩应作为评选奖学金的主要标准，因为这是最公正、最客观的评价体系。认为注重享乐可能会妨碍学生遵循学校的学术规定，对学习不尽职。,同学,3,86
教育/培训/学校/校园,学生评教制度,成就,大同,学生评教时，可能会出现他们希望自己的成绩更好，因此给予老师较高的评价以取得老师的欢心，这与公平的价值观冲突，因为这样的评价可能并不真实，也可能影响其他学生的权利,学校为提高教学质量，提出了学生评教制度，学生可以对授课老师进行打分评价。目的是让教师了解自己的教学得分来改进其教学方式，但它也带来了分歧，因为有些学生可能会利用这个制度来获取老师的欢心，为了自己的利益，给予老师较高的分数，从而影响了这个制度的公正性和公平性。,小明，是一个明确追求自我成就的学生，他理智、目标明确，对自我要求比较高，认为努力和能力是实现目标的关键,觉得好的成绩是自己目前最迫切的追求，所以在对老师进行评价时，会给予老师较高的分数，以便得到老师的欢心，提高自己的学业成绩。,小红，是一个非常注重公平和公正的学生，她对遵守规则和公平公正的原则有深厚的信念，希望能为社区创造一个公平公正的环境,认为评教的过程应当是公正和真实的，会在评教过程中客观地、公正地对老师的授课进行打分，而不会为了个人的利益去歪曲评价。,同学,1,87
教育/培训/学校/校园,学生评教制度,自我导向,遵从,在评教过程中，一些学生可能会选择按照自己的观点和感受进行评价，而不是遵从学校的期望或主流观点，这就可能导致自我导向与遵从的价值观发生冲突,最近，高校决定实行学生评教制度，期望通过这种方式了解教师的教学质量，促进教师的教学改进。然而，这个决策引起了不少争议：一些学生认为他们的观点和感受应得到充分的表达和尊重，应该根据自己的实际体验进行评价；而另一些学生则认为应该尊重和遵从学校的规定和期望，尽可能做出有利于学校教学品质提高的评价。,李明，一个热衷于独立思考的学生，他善于分析事物，对于事物有自己独特的看法和理解,认为学生评教不仅是对教师教学水平的反馈，更是学生对教学体验的主观反映。因此，决定按照自己的体验和感受，以及对教学的理解去进行教师评价，即使这可能导致与学校的期望产生一定的冲突。,王雅，一个遵规守纪、尊重传统的学生，她相信学校的制度和决策是有其深思熟虑的，学生应该尊重并遵从学校的规定,认为学生评教是一种学校的规章制度，学生应该按照学校的期望去进行评价，即使这可能忽视或牺牲一部分学生的个人感受。决定按照学校的期望，以及对教学质量的理解去进行教师评价。,同学,1,88
