domain,theme,value1,value2,brief introduction,scene,role1,D1,role2,D2,relation,conflict_level,id
教育/培训/学校/校园,学生纪律规章制定,权力,慈善,在学校环境中，学生可能有机会获得一些权力，比如成为学生会的会长或其他领导职务,某高中学生纪律规章需要重新修订。旧的规章已经根据新的省级教育政策不再适用。新的规章需要满足各方面需求，包括学校的声誉，教师的需求，以及学生的福利。然而，校长和学生会会长在规章的具体内容上产生了分歧。,校长汤姆，他是一个非常严谨的人，有着一种权威的威严。他相信，为了学校的声誉和维持严格的纪律，规章应该做出严格的规定,新的纪律规章应该包括更严格的考勤制度，以及对学生违规行为的更严格的惩罚。,学生会会长玛丽，她来自一个充满爱心的家庭，对于帮助和关怀他人非常热衷。她认为，虽然规章是必要的，但是应当考虑到学生的情况和需求，尤其是生活在贫困家庭的学生,建议规章应该包括更多关于学生权利的规定，以及对于处于贫困状况的学生给予更多的理解和宽容。,校长汤姆是学生会会长玛丽的老师和顾问。,3,38
教育/培训/学校/校园,学生纪律规章制定,安全,刺激,校园纪律规章的制定，一方面需要确保学生的安全，例如禁止危险的行为，鼓励遵守规则，这体现了安全的价值,为了提高学生的纪律性并且保证校园的和谐与稳定，学校决定制定一套新的学生纪律规章。规章的内容包括日常行为规范，上课纪律，以及课外活动的安全规范等。然而，在规章中是否应该包含冒险活动的禁止，如攀岩、滑板等，成为了决策的分歧。,校长玛丽，作为教育者，她非常注重每个学生的安全，希望每个学生都能在安全的环境下学习和成长,考虑到学生的安全，决定在规章中明确禁止学生参与包括攀岩、滑板等在内的冒险活动。,体育老师约瑟夫，他认为学生应该有面对挑战和克服困难的机会，这对他们的成长非常重要。他认为通过适当的冒险活动能提升学生的能力,建议学校应该允许学生在有保护措施和老师监督的情况下参与冒险活动，以满足他们的求知和冒险欲望。,同事,3,39
教育/培训/学校/校园,校园餐饮选择,成就,享乐主义,学生可能面临是否牺牲快乐的时光去学习以取得更好的成绩的决定,在一个富有挑战性的大学环境中，新的校园餐饮合同被提案，其中包含了一个决定：是否增加开放时间，提供更多的餐点选择，以满足学生们不同时间、不同口味的需求。然而，这也可能让学生们花费更多的时间在享受美食中，而不是专注于学业。,莉莉，她是学生会的主席，一直以来都是以优秀的学习成绩和清晰的目标闻名。她倾向于优质的学习环境，并且始终保持高度的责任感,认为增加开放时间并提供更多的餐点选择会让学生过度沉迷于餐厅，倾向于保持现状，使学生更加专注于学业，以便取得更好的学业成就。,杰克，他是学校的人气名人，以其轻松的生活态度和对生活热爱而广受欢迎。他认为生活应该是丰富多彩的，并且总是寻找各种新鲜事物和美食,非常支持增加开放时间和提供更多的餐点选择，认为这将为学生带来更多的乐趣，丰富他们的校园生活，让他们在学习之外也能享受到快乐。,莉莉和杰克是同样是学生会成员，且在校园餐饮合同上有着明显的价值观冲突。,3,40
教育/培训/学校/校园,校园餐饮选择,安全,刺激,在校园餐饮选择中，学生可能会对尝试新的或异国的食物感到兴奋，但他们也可能对这些不熟悉的食物的安全性和质量感到担忧,大学即将开设新的食堂，食堂将在下个月内引进很多国际美食以吸引更多的学生。但是大家对此持不同的观点，对于食堂的食品来源和卫生条件有所担忧，同时也对新的食物风味感到期待。,艾米，她是学生会的健康和安全委员，对于食品的安全和卫生方面有非常深入的了解,主张应该在引进新的美食前，严格检查食品来源，确保新食堂的卫生和食品的质量，同时也提出在采购中尽可能选择有机和本地产的食品。,詹姆士，他是一位美食俱乐部的成员，对于各种新奇异国美食总能抱有极高的热情，他期待食堂能提供多样化的食品选择,倾向于引进尽可能多的异国美食，认为这能丰富大家的饮食和文化体验，同时也能让校园生活变得更加有趣。,艾米和詹姆士都是学生组织的活跃成员，他们经常需要在学校各类事件中合作，互相之间有着良好的工作关系和友情。,3,41
教育/培训/学校/校园,校园餐饮选择,传统,自我导向,一些学生可能更愿意遵循他们家庭的饮食习惯和传统，而另一些学生可能更愿意探索和尝试自己的饮食选择,在小明所在的大学，学校的餐厅正在决定新一学期的菜品选择。为了照顾到各国各地的学生，餐厅决定提供更多元化的饮食，并且计划投票决定是否在每周添加一次国际菜品日。虽然这将满足很多人寻求新鲜和多元食物的需求，但也会打破过去一直遵循的中国传统菜品。,李华，一个来自中国西部的大学生，他很尊重家庭和文化传统，相信吃饭是一个熟悉和安慰的过程，需要尊重历史和传统，不希望在食物上有太多的突兀改变,决定投票反对每周的国际菜品日，觉得餐厅应该坚持提供传统的中国菜，因为那才是他们文化的一部分，也是他们舒适和熟悉的。,小明，一个对新事物充满好奇心的大学生，他喜欢在日常生活中探索新事物，尤其是不同的饮食文化，他认为这是增长见识的好方法,决定投票支持每周的国际菜品日，期待在餐厅品尝各种各样的美食，并乐于尝试不同的风味。,室友,3,42
教育/培训/学校/校园,校园餐饮选择,权力,慈善,在一些情况下，学生可能需要决定是否使用他们的地位或影响力来改变餐点选择，以利于他人（如推动健康或环保的饮食选择），这可能会与他们自己对于食物的欲望和喜好产生冲突,最近，高校A的校园食堂的饮食空间由于疫情影响，有了一些变化。学校准备重新选择食堂的食品供应商，并将选择权交给了学生会。学生会的成员们需要考虑的关键因素包括食品种类、价格、口味、营养以及环保等。然而，如何平衡这些因素并做出最佳的选择，却引发了一场关于"是否应该倾向于提供更健康、环保的饮食选择，甚至牺牲一些口感和价格方面的考量"的争议。,杰森，学生会主席，他是一个自信且主导力强的人，他在学生会的影响力很大，有着一定的权力。他喜欢积极主导并决策事物,更关注的是在选择食品供应商中保持自己的权威和领导地位，倾向于选择那些能够满足大多数学生口味和价格要求，也即是习惯的普通食品供应商，即使他们可能并不注重食品的营养和环保。,艾米，学生会的负责健康和环保事务的部长，她深受学生们的喜欢和尊重，她非常关注他人的福利和健康生活,强烈推荐选择那些提供健康食品，注重环保的供应商，即使这可能会提高食品的价格，甚至可能口味上得不到大部分学生的喜爱。,杰森和艾米在学生会都有较高的地位，有密切的工作交往，平时关系友好。他们在这个问题上的分歧，可能会对他们的关系产生影响。,3,43
教育/培训/学校/校园,校园餐饮选择,遵从,享乐主义,学生可能会面临是否遵守健康饮食的规定和建议，或者满足自己对于美味但可能不健康食物的渴望的选择，这种选择可能会导致遵从与享乐主义之间的冲突,在林肯大学的校园内，餐厅最近提出了一个新的餐饮选择方案――引入一些新的美食品牌和小吃供学生选择，同时在这些美食中，餐厅也尽可能保留了一些健康饮食的选择。此举引起了学生们的热烈讨论，一部分学生认为这是一个好的变化，因为这意味着他们可以尝试到更多的美味食物；另一部分学生则担心这些美味的食物可能不利于他们的健康，因此他们更倾向于坚持原有的健康饮食选择。,杰西卡，她是大二的学生，有着讲究健康饮食的习惯，并且是学生会的成员之一。她很尊重学校的规定和建议，为了保持健康，她总是在餐厅选择蔬菜和水果等健康食品,决定在学生会里提出自己的观点，反对在餐厅引入过多的美味小吃，认为这对于鼓励学生维持健康饮食的学校政策是不利的。,克里斯蒂安，他是杰西卡的同学，同时也是他们班级的食物委员。他非常喜欢尝试新的美食，对于校园餐厅的新改变他感到很兴奋,决定积极支持餐厅的新方案，认为这样可以让校园生活变得更加丰富多彩，并且自己准备尝试所有新引入的美食，以给其他同学提供美食推荐。,朋友,3,44
教育/培训/学校/校园,学科专业引入,大同,权力,在教育/培训/学校/校园中引入新的学科专业时，大同的价值观可能强调所有学生平等接受教育的机会，而权力的价值观可能会导致教育资源向少数优质学科倾斜，使所有人的福利不再平等,雅典娜大学是一所全球知名的综合性大学，近年来，由于人工智能领域的快速发展，该大学决定引入人工智能这一新的学科专业。此决策主要是为了能培养更多适应社会发展的人才，与此同时，能提升学校在学术界的影响力。但是，这个决策引起了学校内部的分歧，主要集中在是否应该在引入新的专业时更注重所有学生的公平接受教育机会，或者是更倾向于将教育资源集中于新的优质学科。,GeorgeSmith，他是雅典娜大学的社科学院的一名教授，是学院的资深成员，他一直强调公平教育的重要性，认为每一位学生都应该有平等接受教育的机会,主张在引入人工智能专业的同时，也要保障其他学科的教育资源，不应过度偏重新的专业，要保持教育的平等性和全面性。,AliceJohnson，她是雅典娜大学的校长，是一位有远见和魄力的领导，她重视学校的社会影响力和声望，对学校的发展有着独到的见解,主张倾向于将更多的教育资源投入到人工智能这一前沿科技领域，以便培养出更多的专业人才，并以此提升学校的社会声望和影响力。,他们都是雅典娜大学的重要决策者，共同讨论和决定学校的发展方向。,3,45
教育/培训/学校/校园,学科专业引入,慈善,成就,慈善价值观可能会强调帮助学习困难的学生，而成就价值观可能会鼓励个人的学术成功和竞争，这两者之间可能会产生冲突,在一个知名的高中，为了满足社会的需求，学校决策团队决定引入一个新的学科专业――人工智能。这个决策的目的是让学生了解并掌握这个新兴技术，为他们未来的职业生涯打开更多可能。然而，这个决策的实施带来了分歧：一方面，希望所有学生都有公平的机会学习这个新专业；另一方面，也希望能够找到有潜力的学生，通过竞争提升他们的专业技能。,叫做马丽的教师，负责人工智能课程的设计和教学。马丽认为教育的目的是帮助每一个孩子实现他们的潜能，因此她尊重每一个孩子的学习节奏，并尽其所能为他们提供帮助。马丽的价值观是慈善。,决定让所有学生都参与这个新的学科专业，而不仅仅是那些表现出色的学生。她认为这样可以让更多的学生接触到这个新技术，并帮助他们找到自己的兴趣所在。,叫做王立的校长，他一直致力于推动学校的学术成绩提升，希望通过教育培养出优秀的，有竞争力的学生。因此，他的价值观是成就。,拥护引入人工智能专业，但是提出只有在相关测试中获得高分的学生才有资格参与这个新专业的学习。认为这样可以让有潜力的学生充分发挥他们的优势，并对他们形成积极的激励。,马丽和王立都是高中的决策者，他们共同为学校的教育方针和课程设置做出决策。尽管他们各自的立场不同，但他们都希望找到对学生最有利的教育方法。,3,46
教育/培训/学校/校园,学科专业引入,传统,自我导向,新的学科专业可能需要学生自我探索、创新，这与传统的教学模式和价值观可能会产生冲突,华氏大学是一所传统的学府，一直以其严谨的教学和科研成果享誉学界。然而，随着科技的飞速发展，新的学科专业如数据科学、人工智能等涌现出来。因此，华氏大学的教务委员会对是否引入这些新学科专业进行了深入讨论，此决策的主要目的在于更新教学内容，提高教学质量，但它也带来了一些分歧。,李敬，华氏大学长期任教的老教授，他一直尊重和捍卫着学术的传统，他认为教育的核心是传统的学术思维和理论体系,认为新的学科可能会破坏大学的传统教学模式，因此发表强烈反对引入新学科的决策，坚持传统学科教学模式。,张晖，华氏大学的年轻教师，他是一位活跃的科研工作者，深知科技发展的潜力。他提倡创新，勇于挑战新事物,认为引入新的学科专业是大学发展的必然趋势，支持这一决策，并提出自己能够负责策划并推进新学科的教学安排。,他们在华氏大学的教务委员会中都是重要的决策者，虽然在教育理念上有所冲突，但都是为了学校的利益在努力。,3,47
教育/培训/学校/校园,学科专业引入,遵从,自我导向,在学业上的要求可能要求学生严格自律和遵从规则，而享乐主义的价值观可能导致学生追求个人快乐，忽视学业，两者之间可能产生冲突,一所知名大学计划引入电子竞技专业，这是一种全新的尝试，目的是方便学生把兴趣和专业结合，同时也为电竞行业的发展贡献人才。但是这个决策在校内引起了分歧，主要的问题在于是否应该把电子竞技设置为专业学科。,张教授，是大学的董事会成员，他严谨认真，对教育有深入的理解，同时对新事物持谨慎的态度,认为引入电子竞技专业并非是优先事项。主张坚持教育的传统目标，强调理论知识和实际能力的结合，希望学生能专注于更有深度和广度的学习，不希望学生将时间和精力过多的投入在电竞这样的娱乐活动上。,李同学，是大学的一名学生，他热爱电子竞技，并且在这方面有一定的成就。他期待通过学习和锻炼，能够将自己的兴趣转变为职业,非常支持大学引入电子竞技专业。认为电子竞技不仅是一种娱乐，还是一种体验快乐、积累经验和锻炼技能的方式。引入电子竞技专业，可以让喜欢这方面的同学有更多机会深入学习，实现个人价值。,张教授是李同学的导师。,3,48
教育/培训/学校/校园,学科专业引入,安全,刺激,在引入新的学科专业时，安全的价值观可能会强调维持现状以保持稳定，而刺激的价值观可能会追求新奇和挑战，两者之间可能产生冲突,Creston大学的教务长正在考虑是否引入一门新的学科专业――人工智能。教务长相信这一科目引人进来，可以为学校吸引更多的学生而且可以使学校在先进科技教育领域更具竞争力。然而，这个决策也引起了一些分歧。一方面，有人担心引入新的学科专业可能会对现有课程产生干扰，影响学校的稳定。另一方面，有人认为创新和变化是进步的必要部分，应该积极采纳新的学科专业。,教授Jane，她是Creston大学的多年教师，以教学严谨、重视学科传统而著称。她认为大学的首要任务是稳定地提供高质量的教育,反对引入新的学科专业。认为这可能会改变学校的课程设置，影响学生的学习节奏，甚至可能会削弱对其他专业的投资。更倾向于优化现有课程，而不是引入未经验证的新专业。,教授Mike，他是计算机科学系的一名年轻而活跃的教师。他一直关注最新的科技动态，并认为创新与变化是推动教育发展的重要原动力,支持引入人工智能专业。认为现在是学校进行改革，跟上科技发展步伐的最佳时机。相信这不仅可以吸引更多的学生，还可以为学生提供更多职业发展的可能性。,同事,3,49
教育/培训/学校/校园,教师培训项目,大同,权力,在教师培训项目中，可能会遇到确保所有教师公平获得培训的机会（大同）和权力冲突的情况,学校要实施一场为期一周的教师培训项目，意在提升教师的教学能力和教育理念。由于资源有限，学校决定，教师们需要经过评选，前十名有资格参加此次培训项目。然而，此决策引起了分歧，一部分教师认为应该实行公平原则，给所有教师提供培训的机会，另一部分教师则认为，优胜劣汰的原则更能激发教师们的积极性，提高教学质量。,奥利维亚是一名高中的物理老师，她一直倡导平等、公正的原则，她认为每位教师都应该有成长的机会,提出应该让所有的教师都有参加培训的机会，无论他们的教学表现如何，相信这样可以增强教师团队的和谐，提高教师的整体素质。,亚历山大是学校的行政主任，他是一个有野心和领导力的人，他认为通过竞争才能推动个人和团队的发展,坚持要进行评选，只让前十名的教师参加培训，认为这能激发教师们的积极性，推动他们提高教学质量，从而提高学校的整体教育水平。,奥利维亚和亚历山大都是学校的教职员工，他们在工作中经常需要进行交流和协作。,3,50
教育/培训/学校/校园,教师培训项目,成就,遵从,教师可能会面临成就和遵从的冲突，他们可能希望通过独特的教学方式取得成就感，但这可能会违反学校的教学准则和预期，因此需要寻找平衡,政府决定推广一种新的、创新的教学方式，举行全国性的教师培训项目。这种教学方式强调学生的主动性和创新性，要求教师改变传统的授课方式，采用一种更加开放、自由的教学方式。然而，这种新的教学方式并未经过充分的实验验证，且可能违反教育部的一些教学准则。这个决策带来了一些分歧，教师们对此有不同的看法。,罗伯特，一名具有深厚教育情怀、善于尝试新教学方法和理念的高中物理老师,积极支持这一教师培训项目，希望通过尝试新的教学方式，实现教学的突破和自我价值的实现。认为这是实现自我价值的重要机会，愿意接受新的挑战，以期取得更大的教学成就。,玛丽，一名严谨、尊重教育规则并且坚持传统教学方式的中学英语老师,对这个项目持保留态度，认为规范的教学方式和教育部的教学准则比试验性的、未经验证的新方法更重要。坚持按照学校的教学计划进行教学，尊重和遵守教育部门的规定。,罗伯特和玛丽是同一所学校的教师，常在教师会议上进行教学经验交流。,1,51
教育/培训/学校/校园,教师培训项目,自我导向,安全,一些教师可能倾向于探索新的教学方法和内容以满足他们的创新精神（自我导向），但这可能会带来困扰，因为新的尝试总是伴随着不确定性和风险（安全）,学校的教师培训项目正在进行决策，新的学期即将开始，校方计划针对教师们进行一次培训，目的是为了提高教师们的教学质量，使学生们能够得到更好的教育。然而，在培训内容的选择上，校方产生了分歧。一部分人认为应该引入新的教学理论和方法，鼓励教师进行类似"反转课堂"或"混合式学习"等新颖的教学模式尝试。另一部分人则认为应该坚持现有的教学方式，着重于提高教师的教学技巧，以保持稳定的教学环境。,Tom，他是一位年轻有活力的教师，具有冒险精神，对新的教学方法和理论充满了热情并乐于尝试,主张应该利用这次的教师培训机会引入新的教学理论和方法，尝试新颖的教学模式，以激发教师和学生的创新精神和主动性。,Sara，她是一位经验丰富的老教师，强调教学稳定性和规范性，注重学生的安全和顺利学习,坚持应该以提高教师的教学技巧为主，坚持现有的教学方式，以保持稳定的教学环境。,Tom和Sara在同一所学校，均为教育教学团队的重要成员，他们共同参与并影响着学校的教师培训项目决策。,3,52
教育/培训/学校/校园,教师培训项目,刺激,传统,在教师培训项目中，可能会存在刺激与传统的冲突,一所乡村小学正面临教师培训项目的决策，这个项目是由教育局提出，目的是通过现代化的教学方法和技术，提高乡村教师的教学质量。然而，这个项目需要教师学习新的教学理念和操作新的教学设备，而这与小学长期以来保持的传统教学方式有所冲突，引发了学校内部的分歧。,张老师，他是一名年轻的教师，具有开放的思想，对新事物有极高的好奇心和接受能力。他很善于利用新的教学工具和方法，以创新的方式教学。他相信新的教学方式能让孩子们获得更好的学习体验，进而提高教学效果,提倡接受这个教师培训项目，认为这不仅能提升自己的教学水平，也能使孩子们更好的适应未来社会的需求。,李校长，他是一名经验丰富的老校长，一直坚持传统的教学理念，认为稳定的教学环境和深入浅出的教学方式是最适合孩子们的。他担心新的教学方式可能会打乱现有的教学秩序，对孩子们产生不良影响,反对接受这个教师培训项目，认为现有的教学模式已经十分成熟稳定，新的教学方式并不能带来实质性的提升，反而可能带来不确定的风险。,张老师是李校长的下属，他们分别代表了学校内部的新老观点。,3,53
教育/培训/学校/校园,教师培训项目,享乐主义,传统,教师可能会面临享乐主义与责任的冲突,学校基层工作人员正在讨论如何安排本学期的教师培训项目。目标是使教师们能够获得最新的教育理念和技巧，提升教学质量。然而，在决定培训内容和方式时，不同理念的冲突产生了分歧，一方面，有人认为应该采取轻松的方式，如组织游戏、旅行等提升团队协作能力和促进情感交流，另一方面，有人坚持应该进行传统的学术讲座和研讨会，强调理论的学习和交流。,李华，一位年轻、积极的教育工作者，认为应该用新颖、有趣的方式进行教师培训，比如组织一些团队游戏或者旅行，可以让教师们在轻松愉快的环境中提升职业技能。李华的价值观是享乐主义。,建议安排一次教师团队旅行，结合户外游戏来培训团队协作和情感交流，让教师们在享受乐趣的同时也能提升专业技能。,王老师，是一位经验丰富、循规蹈矩的教育工作者，坚持认为教师培训应重视教育理念、教学方法等的系统学习，应以理论研讨和学术讲座为主。王老师的价值观是传统。,反对采取轻松的方式进行教师培训，提出应该安排一系列的专业讲座和研讨会，强调理论的学习和交流，让教师们更系统、深入地理解和掌握最新的教育理念和技巧。,同事,3,54
